<?xml version="1.0" encoding="UTF-8"?>
<!DOCTYPE DDDB SYSTEM "../../DTD/geometry.dtd">
<DDDB>
<!-- """"""""""""""""""""""""""""""""""""""""""""""""""""""""""""""""""" --> 
<!--   
  CVS tag: $Name: not supported by cvs2svn $
  $Log: not supported by cvs2svn $
  Revision 1.1.1.1  2007/01/30 13:34:59  marcocle
  CVS based back up for the SQLite conditions database

  Revision 1.6  2006/02/06 15:54:00  cattanem
  DC06 geometry and cleanup of older stuff

  Revision 1.5  2005/06/06 15:59:43  gcorti
  Calo tilt

  Revision 1.4  2003/12/05 13:59:43  cattanem
  add Calo changes

  Revision 1.3  2002/09/12 09:32:57  cattanem
  Add vertical Rich, Velo optimisation

  Revision 1.2  2002/02/28 10:28:59  pakhlova
  *** empty log message ***

  Revision 1.1  2001/12/15 16:05:36  ibelyaev
  The first version of  detailed Ecal description by Galina Pakhlova
--> 
<!-- """"""""""""""""""""""""""""""""""""""""""""""""""""""""""""""""""" --> 
<!-- ******************************************************************* --> 
<!--  Geometry of the Middle Section of the Electromagnetic Calorimeter  -->
<!--                    Logical Volumes Definition                       --> 
<!-- ******************************************************************* --> 

<!-- %%% Ecal Middle Section %%% -->

  <logvol name = "MidSection" material="Vacuum">

   <subtraction name = "Ecal_Middle_Section">
         <box  name  = "Middle_Box"
                sizeX = "EcalMidXSize"
                sizeY = "EcalMidYSize"
                sizeZ = "EcalMidModLength"/>

             <box  name  = "Middle_Subtracted_Box"
                   sizeX = "EcalInnXSize"
                   sizeY = "EcalInnYSize"
                   sizeZ = "EcalMidModLength+EcalTolerance"/>
   </subtraction>

<!-- % Middle Block Installation as Matrix Elements of Middle Section % --> 
                         
  <paramphysvol2D number1 = "4" number2 = "2">
      <physvol name = "Middle_Up_Rows"
               logvol = "/dd/Geometry/DownstreamRegion/Ecal/Installation/MidBlock">
                  <posXYZ x = "-12*EcalModXSize"
                          y = " 9*EcalModYSize"/>
      </physvol>
           <posXYZ x = "8*EcalModXSize"/>
           <posXYZ y = "-2*EcalModYSize"/>
   </paramphysvol2D>

    <paramphysvol2D number1 = "2" number2 = "6">
      <physvol name = "Middle_Left_Right_Rows"
               logvol = "/dd/Geometry/DownstreamRegion/Ecal/Installation/MidBlock">
                  <posXYZ x ="-12*EcalModXSize"
                          y =" 5*EcalModYSize"/>
      </physvol>
           <posXYZ x = "24*EcalModXSize"/>
           <posXYZ y = "-2*EcalModYSize"/>
    </paramphysvol2D>

    <paramphysvol2D number1 = "4" number2 = "2">                      
       <physvol name = "Middle_Down_Rows"
                logvol = "/dd/Geometry/DownstreamRegion/Ecal/Installation/MidBlock">
                   <posXYZ x = "-12*EcalModXSize"
                           y = " -9*EcalModYSize"/>
       </physvol>
           <posXYZ x = "8*EcalModXSize"/>
           <posXYZ y = "2*EcalModYSize"/>
    </paramphysvol2D>
   </logvol>
<!-- ******************************************************************* -->

<!-- %%% Ecal Middle Block %%% -->

<logvol name = "MidBlock" material="Vacuum">
    <box  name  = "Middle_Block"
                   sizeX = "8*EcalModXSize"
                   sizeY = "2*EcalModYSize"
                   sizeZ = "EcalMidModLength"/>

<!-- %%% Ecal Module Installation as 8 x 2 Matrix Elements 
                                  of Middle Block Section %%% -->                        
   <paramphysvol2D number1 = "8" number2 = "2">
      <physvol name = "Middle_Module_Rows"
               logvol = "/dd/Geometry/DownstreamRegion/Ecal/Modules/Middle">
                  <posXYZ x = "-3.5*EcalModXSize"
                          y = " 0.5*EcalModYSize"/>
      </physvol>
           <posXYZ x = "   EcalModXSize"/>
           <posXYZ y = "-1*EcalModYSize"/>
   </paramphysvol2D>
  </logvol>
<!-- ******************************************************************* -->
 </DDDB> 
